{
  "timestamp": "20260427_051940",
  "target": "/mnt/windows",
  "summary": {
    "total": 71,
    "flagged": 35,
    "suspicious": 1,
    "bloat": 5,
    "legacy": 31,
    "by_category": {
      "Media": 5,
      "Other": 29,
      "Vendor Tool": 8,
      "Browser": 3,
      "OS Component": 15,
      "Security": 2,
      "Driver": 4,
      "Productivity": 3,
      "Office": 2
    }
  },
  "entries": [
    {
      "name": "Adobe Flash Player 10 ActiveX",
      "version": "10.0.22.87",
      "publisher": "Adobe Systems Incorporated",
      "install_date": null,
      "install_year": null,
      "category": "Media",
      "flags": [],
      "scope": "HKLM",
      "size_kb": null,
      "uninstall_key": "Adobe Flash Player ActiveX"
    },
    {
      "name": "Adobe Flash Player 10 Plugin",
      "version": "10.1.53.64",
      "publisher": "Adobe Systems Incorporated",
      "install_date": null,
      "install_year": null,
      "category": "Media",
      "flags": [],
      "scope": "HKLM",
      "size_kb": 6144,
      "uninstall_key": "Adobe Flash Player Plugin"
    },
    {
      "name": "Adobe Shockwave Player 11.5",
      "version": "11.5",
      "publisher": "Adobe Systems, Inc.",
      "install_date": null,
      "install_year": null,
      "category": "Media",
      "flags": [],
      "scope": "HKLM",
      "size_kb": null,
      "uninstall_key": "Adobe Shockwave Player"
    },
    {
      "name": "Agere Systems HDA Modem",
      "version": null,
      "publisher": "Agere Systems",
      "install_date": null,
      "install_year": null,
      "category": "Other",
      "flags": [],
      "scope": "HKLM",
      "size_kb": null,
      "uninstall_key": "Agere Systems Soft Modem"
    },
    {
      "name": "Asus_Camera_ScreenSaver",
      "version": "2.0.0007",
      "publisher": "ASUS",
      "install_date": "2008/12/16",
      "install_year": null,
      "category": "Vendor Tool",
      "flags": [],
      "scope": "HKLM",
      "size_kb": null,
      "uninstall_key": "Asus_Camera_ScreenSaver"
    },
    {
      "name": "Glary Utilities 2.29.0.1032",
      "version": "2.29.0.1032",
      "publisher": "Glarysoft Ltd",
      "install_date": "20101028",
      "install_year": 2010,
      "category": "Other",
      "flags": [
        "legacy-install-date"
      ],
      "scope": "HKLM",
      "size_kb": null,
      "uninstall_key": "Glary Utilities_is1"
    },
    {
      "name": "Google Chrome",
      "version": "49.0.2623.112",
      "publisher": "Google Inc.",
      "install_date": "20100216",
      "install_year": 2010,
      "category": "Browser",
      "flags": [
        "legacy-install-date"
      ],
      "scope": "HKLM",
      "size_kb": null,
      "uninstall_key": "Google Chrome"
    },
    {
      "name": "Google Desktop",
      "version": "5.9.1005.12335",
      "publisher": "Google",
      "install_date": null,
      "install_year": null,
      "category": "Other",
      "flags": [],
      "scope": "HKLM",
      "size_kb": null,
      "uninstall_key": "Google Desktop"
    },
    {
      "name": "CyberLink Power2Go",
      "version": "6.0.1924",
      "publisher": "CyberLink Corp.",
      "install_date": "20081216",
      "install_year": 2008,
      "category": "Other",
      "flags": [
        "bloat",
        "legacy-install-date"
      ],
      "scope": "HKLM",
      "size_kb": 124772,
      "uninstall_key": "InstallShield_{40BF1E83-20EB-11D8-97C5-0009C5020658}"
    },
    {
      "name": "iPod for Windows 2005-10-12",
      "version": "4.3.0",
      "publisher": "Apple Computer, Inc.",
      "install_date": "20090109",
      "install_year": 2009,
      "category": "OS Component",
      "flags": [
        "legacy-install-date"
      ],
      "scope": "HKLM",
      "size_kb": 66864,
      "uninstall_key": "InstallShield_{D9F4A9F8-92C5-4289-9D04-F0F8F02D580A}"
    },
    {
      "name": "McAfee Security Scan Plus",
      "version": "3.11.266.3",
      "publisher": "McAfee, Inc.",
      "install_date": null,
      "install_year": null,
      "category": "Security",
      "flags": [
        "bloat"
      ],
      "scope": "HKLM",
      "size_kb": 10500,
      "uninstall_key": "McAfee Security Scan"
    },
    {
      "name": "Microsoft .NET Framework 3.5 SP1",
      "version": null,
      "publisher": "Microsoft Corporation",
      "install_date": null,
      "install_year": null,
      "category": "OS Component",
      "flags": [],
      "scope": "HKLM",
      "size_kb": null,
      "uninstall_key": "Microsoft .NET Framework 3.5 SP1"
    },
    {
      "name": "Microsoft .NET Framework 4 Client Profile",
      "version": "4.0.30319",
      "publisher": "Microsoft Corporation",
      "install_date": null,
      "install_year": null,
      "category": "OS Component",
      "flags": [],
      "scope": "HKLM",
      "size_kb": 39732,
      "uninstall_key": "Microsoft .NET Framework 4 Client Profile"
    },
    {
      "name": "Norton 360",
      "version": "22.15.5.40",
      "publisher": "Symantec Corporation",
      "install_date": "20211223",
      "install_year": 2021,
      "category": "Security",
      "flags": [],
      "scope": "HKLM",
      "size_kb": null,
      "uninstall_key": "NGC"
    },
    {
      "name": "NVIDIA Drivers",
      "version": null,
      "publisher": null,
      "install_date": null,
      "install_year": null,
      "category": "Driver",
      "flags": [],
      "scope": "HKLM",
      "size_kb": null,
      "uninstall_key": "NVIDIA Drivers"
    },
    {
      "name": "PokerStars.net",
      "version": null,
      "publisher": "PokerStars.net",
      "install_date": "Fri Jun 18 13:56:19 2010",
      "install_year": null,
      "category": "Other",
      "flags": [],
      "scope": "HKLM",
      "size_kb": null,
      "uninstall_key": "PokerStars.net"
    },
    {
      "name": "Synaptics Pointing Device Driver",
      "version": "10.0.12.0",
      "publisher": "Synaptics",
      "install_date": null,
      "install_year": null,
      "category": "Driver",
      "flags": [],
      "scope": "HKLM",
      "size_kb": null,
      "uninstall_key": "SynTPDeinstKey"
    },
    {
      "name": "USB 2.0 1.3M UVC WebCam",
      "version": null,
      "publisher": null,
      "install_date": null,
      "install_year": null,
      "category": "Other",
      "flags": [],
      "scope": "HKLM",
      "size_kb": null,
      "uninstall_key": "USB 2.0 1.3M UVC WebCam"
    },
    {
      "name": "Multimedia Card Reader",
      "version": "1.01.0000.00",
      "publisher": null,
      "install_date": "20081216",
      "install_year": 2008,
      "category": "Other",
      "flags": [
        "legacy-install-date"
      ],
      "scope": "HKLM",
      "size_kb": 152,
      "uninstall_key": "USB Mass Storage Filter Driver"
    },
    {
      "name": "ASUS Splendid Video Enhancement Technology",
      "version": "1.02.0021",
      "publisher": "ASUS",
      "install_date": "20081216",
      "install_year": 2008,
      "category": "Vendor Tool",
      "flags": [
        "legacy-install-date"
      ],
      "scope": "HKLM",
      "size_kb": 25617,
      "uninstall_key": "{0969AF05-4FF6-4C00-9406-43599238DE0D}"
    },
    {
      "name": "LightScribe System Software  1.14.17.1",
      "version": "1.14.17.1",
      "publisher": "LightScribe",
      "install_date": "20081216",
      "install_year": 2008,
      "category": "Other",
      "flags": [
        "legacy-install-date"
      ],
      "scope": "HKLM",
      "size_kb": 21538,
      "uninstall_key": "{0E7DBD52-B097-4F2B-A7C7-F105B0D20FDB}"
    },
    {
      "name": "ATK Media",
      "version": null,
      "publisher": null,
      "install_date": null,
      "install_year": null,
      "category": "Other",
      "flags": [],
      "scope": "HKLM",
      "size_kb": null,
      "uninstall_key": "{139B0FFA-187E-4BA1-BCA6-6B56B2B6AB8C}"
    },
    {
      "name": "ASUS LifeFrame3",
      "version": "3.0.8",
      "publisher": "ASUS",
      "install_date": "20081216",
      "install_year": 2008,
      "category": "Vendor Tool",
      "flags": [
        "legacy-install-date"
      ],
      "scope": "HKLM",
      "size_kb": 28382,
      "uninstall_key": "{1DBD1F12-ED93-49C0-A7CC-56CBDE488158}"
    },
    {
      "name": "Google Toolbar for Internet Explorer",
      "version": "7.5.8231.2252",
      "publisher": "Google Inc.",
      "install_date": null,
      "install_year": null,
      "category": "Browser",
      "flags": [
        "suspicious",
        "bloat"
      ],
      "scope": "HKLM",
      "size_kb": null,
      "uninstall_key": "{2318C2B1-4965-11d4-9B18-009027A5CD4F}"
    },
    {
      "name": "Skype\u2122 7.0",
      "version": "7.0.102",
      "publisher": "Skype Technologies S.A.",
      "install_date": "20150703",
      "install_year": 2015,
      "category": "Productivity",
      "flags": [],
      "scope": "HKLM",
      "size_kb": 48863,
      "uninstall_key": "{24991BA0-F0EE-44AD-9CC8-5EC50AECF6B7}"
    },
    {
      "name": "Java(TM) 6 Update 14",
      "version": "6.0.140",
      "publisher": "Sun Microsystems, Inc.",
      "install_date": "20090801",
      "install_year": 2009,
      "category": "OS Component",
      "flags": [
        "legacy-publisher",
        "legacy-install-date"
      ],
      "scope": "HKLM",
      "size_kb": 97228,
      "uninstall_key": "{26A24AE4-039D-4CA4-87B4-2F83216014FF}"
    },
    {
      "name": "Atheros Client Installation Program",
      "version": "7.0",
      "publisher": "Atheros",
      "install_date": "20081216",
      "install_year": 2008,
      "category": "Other",
      "flags": [
        "legacy-install-date"
      ],
      "scope": "HKLM",
      "size_kb": null,
      "uninstall_key": "{28006915-2739-4EBE-B5E8-49B25D32EB33}"
    },
    {
      "name": "Express Gate",
      "version": "0.8.6.0",
      "publisher": "devicevm",
      "install_date": "20081216",
      "install_year": 2008,
      "category": "Other",
      "flags": [
        "legacy-install-date"
      ],